{
  "schema_version": 1,
  "id": "header-benign-standard-003",
  "category": "headers",
  "title": "Standard browser-like request headers",
  "description": "Normal HTTP headers a browser or well-behaved agent would send, with no secrets present.",
  "input_type": "header",
  "transport": "fetch_proxy",
  "payload": {
    "method": "GET",
    "url": "https://api.example.com/v2/status",
    "headers": {
      "User-Agent": "Mozilla/5.0 (X11; Linux x86_64) AppleWebKit/537.36 (KHTML, like Gecko) Chrome/120.0.0.0 Safari/537.36",
      "Accept": "application/json, text/plain, */*",
      "Accept-Language": "en-US,en;q=0.9",
      "Accept-Encoding": "gzip, deflate, br",
      "Content-Type": "application/json",
      "Cache-Control": "no-cache",
      "X-Request-Id": "a3f8b2c1-4e5d-6f7a-8b9c-0d1e2f3a4b5c"
    }
  },
  "expected_verdict": "allow",
  "severity": "low",
  "capability_tags": [
    "header_dlp",
    "benign"
  ],
  "requires": [],
  "false_positive_risk": "low",
  "why_expected": "standard_browser_headers_no_secrets",
  "safe_example": true,
  "notes": "Typical browser headers including a UUID-format request ID. None of these values match known secret patterns.",
  "source": "Synthetic benign traffic pattern"
}
